{"artifact_type":"render_state","draft_output":"PAPER.draft.md","evidence_packet_sha256":["sha256:c40f17d596d43dab8c4cfc2aedf78c92c288cab6eab36830dd24aa1749814201","sha256:9decd9084b43ee65181913f45741c44c87f52f184651ee4255b956f4bf6bd225","sha256:eb388b2b9d0b17174182d365d66585853a29354488fd4de98c515b150de04281","sha256:3ab849171068865e1b58315f8eae406fdb1247356c9a4f8983d98b01ea8ea2ed","sha256:9a349074818db4b7e47b9edcbcb3a06cfb629dd65377ab1821e0b33bc0c5596b","sha256:eff2144ba7fa6bb83e2eb2aa506c83cdc916cb610af9defc69bc07621841fdb0"],"fingerprint":{"config_sha256":"sha256:9f26ba7707983adf04a86072d5da09cbed7e5b56da18b83deca16d7649823075","draft_path":"PAPER.draft.md","draft_sha256":"sha256:6973d473a0871b2c5219d619e3083a225ec50b06fc0ae5a6de084f79904c5e2c","evidence_packet_sha256":["sha256:c40f17d596d43dab8c4cfc2aedf78c92c288cab6eab36830dd24aa1749814201","sha256:9decd9084b43ee65181913f45741c44c87f52f184651ee4255b956f4bf6bd225","sha256:eb388b2b9d0b17174182d365d66585853a29354488fd4de98c515b150de04281","sha256:3ab849171068865e1b58315f8eae406fdb1247356c9a4f8983d98b01ea8ea2ed","sha256:9a349074818db4b7e47b9edcbcb3a06cfb629dd65377ab1821e0b33bc0c5596b","sha256:eff2144ba7fa6bb83e2eb2aa506c83cdc916cb610af9defc69bc07621841fdb0"],"fingerprint_sha256":"sha256:c4d3ebe3bd1be40e7ef01ac196c5f7b216a8246d938453fb52b8a76222bcca4b","input_counts":{"evidence_packet_count":6,"experiment_count":6},"manifest_path":"paper/work/manifest.json","manifest_sha256":"sha256:9fb4784305726d9918677b3b4edd81dd237d0ae58c73e49681e1b5a755e0c44e","renderer_version":"1","schema_version":1,"stage":{"name":"render","version":1}},"manifest_sha256":"sha256:9fb4784305726d9918677b3b4edd81dd237d0ae58c73e49681e1b5a755e0c44e","schema_version":1}
